run_id	kind	commit	deployment_name	model_id	job_id	n_epochs	learning_rate_multiplier	batch_size	rouge_l	delta_vs_base	eval_count	total_seconds	status	decision	description	fingerprint	baseline_run_id
base-20261002T145030556888Z-737002	base	16efa65	gpt-4.1-nano	gpt-4.1-nano							28	60.838535949998914	failed	baseline	Base GPT-4.1-nano	80b8f8225909e3567f76a53e56159d6d541071f60a9969f46986ff248648ad4e	base-20261002T145030556888Z-737002
base-20261002T155033700805Z-a3d40d	base	16efa65	gpt-4.1-nano	gpt-4.1-nano					0.13558829453140325	0	100	205.41202087000056	completed	baseline	Base GPT-4.1-nano	80b8f8225909e3567f76a53e56159d6d541071f60a9969f46986ff248648ad4e	base-20261002T155033700805Z-a3d40d
sft-20261003T055151602285Z-c1d124	sft	1307fe8	ar-ftjob-6dae574b63474a92851f39ca51f0638a	gpt-4.1-nano-2025-04-14.ft-6dae574b63474a92851f39ca51f0638a-auto-c135ebb7	ftjob-6dae574b63474a92851f39ca51f0638a	1	0.1	auto			28	45162.543334	failed	crash	Evaluation stopped after 28 examples: Azure content filter rejected the fixed evaluation prompt (sexual/high)	80b8f8225909e3567f76a53e56159d6d541071f60a9969f46986ff248648ad4e	base-20261002T155033700805Z-a3d40d
base-20261003T055813854041Z-f20494	base	f5fee63	gpt-4.1-nano	gpt-4.1-nano					0.1353572435210746	0	100	195.60752032299933	completed	baseline	Base GPT-4.1-nano	522678b135d56c88325c69b651e63e5f6ec1b5f2fed4d701f8e5da450594ca95	base-20261003T055813854041Z-f20494
sft-20261003T060400244801Z-3f6f93	sft	6b24142	ar-ftjob-6dae574b63474a92851f39ca51f0638a	gpt-4.1-nano-2025-04-14.ft-6dae574b63474a92851f39ca51f0638a-auto-c135ebb7	ftjob-6dae574b63474a92851f39ca51f0638a	1	0.1	auto			43	45891.185381	failed	crash	Evaluation stopped after 43 attempted rows: Azure returned HTTP 500 server_error	522678b135d56c88325c69b651e63e5f6ec1b5f2fed4d701f8e5da450594ca95	base-20261003T055813854041Z-f20494
sft-20261003T062945390909Z-503fc5	sft	177286c	ar-ftjob-6dae574b63474a92851f39ca51f0638a	gpt-4.1-nano-2025-04-14.ft-6dae574b63474a92851f39ca51f0638a-auto-c135ebb7	ftjob-6dae574b63474a92851f39ca51f0638a	1	0.1	auto	0.20649553462544806	0.07113829110437347	100	47436.331587	completed	keep	Baseline SFT improved mean ROUGE-L by 0.071138 versus base; 93 scored and 7 content-filtered rows	522678b135d56c88325c69b651e63e5f6ec1b5f2fed4d701f8e5da450594ca95	base-20261003T055813854041Z-f20494
sft-20261003T092447033004Z-282779	sft	469d282	ar-ftjob-4cd6ff3d7d364efe87a7b61e841c166c	gpt-4.1-nano-2025-04-14.ft-4cd6ff3d7d364efe87a7b61e841c166c-auto-e7728b22	ftjob-4cd6ff3d7d364efe87a7b61e841c166c	2	0.1	auto	0.22371693859022324	0.08835969506914865	100	9768.700157	completed	keep	Two epochs improved mean ROUGE-L by 0.017221 versus the one-epoch SFT; 94 scored and 6 content-filtered rows	522678b135d56c88325c69b651e63e5f6ec1b5f2fed4d701f8e5da450594ca95	base-20261003T055813854041Z-f20494
sft-20261003T112326756160Z-8929f0	sft	30bb3ee	ar-ftjob-444ca08ff141449fbbc8671ecc14ca0b	gpt-4.1-nano-2025-04-14.ft-444ca08ff141449fbbc8671ecc14ca0b-auto-c11e695e	ftjob-444ca08ff141449fbbc8671ecc14ca0b	3	0.1	auto	0.22156345293220975	0.08620620941113516	100	6876.917091	completed	discard	Three epochs scored 0.002153 below the retained two-epoch SFT; 97 scored and 3 content-filtered rows	522678b135d56c88325c69b651e63e5f6ec1b5f2fed4d701f8e5da450594ca95	base-20261003T055813854041Z-f20494
sft-20261003T181639782544Z-eeb996	sft	471e6ff	ar-ftjob-a92cf006bbdf46d89da010de04a8f610	gpt-4.1-nano-2025-04-14.ft-a92cf006bbdf46d89da010de04a8f610-auto-e47c6763	ftjob-a92cf006bbdf46d89da010de04a8f610	2	0.5	1			28	21875.368198	failed	crash	Evaluation stopped after 28 examples: Azure content filter rejected the fixed evaluation prompt (sexual/high)	80b8f8225909e3567f76a53e56159d6d541071f60a9969f46986ff248648ad4e	base-20261002T155033700805Z-a3d40d
sft-20261003T182110427003Z-26a26b	sft	471e6ff	ar-ftjob-a92cf006bbdf46d89da010de04a8f610	gpt-4.1-nano-2025-04-14.ft-a92cf006bbdf46d89da010de04a8f610-auto-e47c6763	ftjob-a92cf006bbdf46d89da010de04a8f610	2	0.5	1			12	22146.012677	failed	crash	Evaluation stopped after 12 examples: Azure returned HTTP 500 server_error	80b8f8225909e3567f76a53e56159d6d541071f60a9969f46986ff248648ad4e	base-20261002T155033700805Z-a3d40d
sft-20261003T182503326869Z-92802e	sft	471e6ff	ar-ftjob-a92cf006bbdf46d89da010de04a8f610	gpt-4.1-nano-2025-04-14.ft-a92cf006bbdf46d89da010de04a8f610-auto-e47c6763	ftjob-a92cf006bbdf46d89da010de04a8f610	2	0.5	1			2	22378.912622	failed	crash	Evaluation stopped after 2 examples: Azure returned HTTP 500 server_error	80b8f8225909e3567f76a53e56159d6d541071f60a9969f46986ff248648ad4e	base-20261002T155033700805Z-a3d40d
sft-20261003T182907121837Z-b4d4de	sft	471e6ff	ar-ftjob-a92cf006bbdf46d89da010de04a8f610	gpt-4.1-nano-2025-04-14.ft-a92cf006bbdf46d89da010de04a8f610-auto-e47c6763	ftjob-a92cf006bbdf46d89da010de04a8f610	2	0.5	1			0	22622.707483	failed	crash	Evaluation stopped before scoring: Azure returned HTTP 500 server_error	80b8f8225909e3567f76a53e56159d6d541071f60a9969f46986ff248648ad4e	base-20261002T155033700805Z-a3d40d
sft-20261004T030741731359Z-ea112e	sft	64763ba	ar-ftjob-a92cf006bbdf46d89da010de04a8f610	gpt-4.1-nano-2025-04-14.ft-a92cf006bbdf46d89da010de04a8f610-auto-e47c6763	ftjob-a92cf006bbdf46d89da010de04a8f610	2	1.0	1	0.22197192908204358	0.08638363455064033	100	53737.317071	completed	crash	Invalid run metadata: resumed LRM 0.5 job was labeled 1.0 from current knobs; rerun with ledger-backed metadata	80b8f8225909e3567f76a53e56159d6d541071f60a9969f46986ff248648ad4e	base-20261002T155033700805Z-a3d40d
sft-20261004T032116487071Z-0a218b	sft	f92026c	ar-ftjob-a92cf006bbdf46d89da010de04a8f610	gpt-4.1-nano-2025-04-14.ft-a92cf006bbdf46d89da010de04a8f610-auto-e47c6763	ftjob-a92cf006bbdf46d89da010de04a8f610	2	0.5	1	0.2140144008208494	0.07842610628944616	100	54552.072805	completed	discard	LRM 0.5 scored 0.009703 below the retained two-epoch SFT; 97 scored and 3 content-filtered rows	80b8f8225909e3567f76a53e56159d6d541071f60a9969f46986ff248648ad4e	base-20261002T155033700805Z-a3d40d
sft-20261004T033851626217Z-d5d267	sft	cbcad1e	ar-ftjob-35509e240d434f7daebcd1e218e3f9df	gpt-4.1-nano-2025-04-14.ft-35509e240d434f7daebcd1e218e3f9df-auto-e08da53a	ftjob-35509e240d434f7daebcd1e218e3f9df	2	1.0	1			57	32897.730809	failed	crash	Evaluation stopped after 57 rows: deployment request timed out	80b8f8225909e3567f76a53e56159d6d541071f60a9969f46986ff248648ad4e	base-20261002T155033700805Z-a3d40d
sft-20261004T051614007367Z-c35a42	sft	3b16631	ar-ftjob-35509e240d434f7daebcd1e218e3f9df	gpt-4.1-nano-2025-04-14.ft-35509e240d434f7daebcd1e218e3f9df-auto-e08da53a	ftjob-35509e240d434f7daebcd1e218e3f9df	2	1.0	1	0.21406712232632993	0.07847882779492668	100	38740.111851	completed	discard	LRM 1.0 scored 0.009650 below the retained two-epoch SFT (different evaluation protocols); 93 scored and 7 content-filtered rows; baseline base-20261002T155033700805Z-a3d40d	80b8f8225909e3567f76a53e56159d6d541071f60a9969f46986ff248648ad4e	base-20261002T155033700805Z-a3d40d
sft-20261004T081018977000Z-6b1252	sft	6456091	ar-ftjob-c507565f095a4fcbbe45be3975940de0	gpt-4.1-nano-2025-04-14.ft-c507565f095a4fcbbe45be3975940de0-auto-7305d66f	ftjob-c507565f095a4fcbbe45be3975940de0	2	0.1	2	0.22703425408062242	0.09144595954921916	100	8567.005056	completed	keep	Batch size 2 improved mean ROUGE-L by 0.003317 versus the retained two-epoch SFT; 94 scored and 6 content-filtered rows	80b8f8225909e3567f76a53e56159d6d541071f60a9969f46986ff248648ad4e	base-20261002T155033700805Z-a3d40d
